{
  "$schema": "https://schemas.aoa.local/models/model-realization.schema.json",
  "schema_version": "aoa_model_realization_v1",
  "kind": "ModelRealization",
  "model_realization_id": "model-realization:openai/gpt-5.6-luna/codex-0.149.1/chatgpt/max/structured-owner-duty/workspace-write/2026-08-24",
  "model_identity_ref": "source/model-identities/openai-gpt-5.6-luna.json",
  "configuration": {
    "access": {
      "provider": "OpenAI",
      "surface": "Codex CLI",
      "auth_regime": "chatgpt_login",
      "billing_regime": "chatgpt_quota",
      "supported_in_api": true
    },
    "runtime": {
      "product": "codex-cli",
      "version": "0.149.1",
      "executable": "codex",
      "model_slug": "gpt-5.6-luna",
      "transport": "exec-jsonl",
      "multi_agent_backend_version": "v1",
      "runtime_subject": {
        "kind": "content_addressed_runtime_package",
        "source": "codex-cli-standalone/x86_64-unknown-linux-musl+codex-code-mode-host",
        "digest": "sha256:304089232ad96d67bf003f0fb59b2fccf305259ac5a1983e969aa6f1b85ca891"
      },
      "resume_surface": "codex exec resume"
    },
    "reasoning_effort": "max",
    "context": {
      "nominal_context_tokens": 272000,
      "effective_context_percent": 95,
      "regime": "codex-model-catalog-default",
      "native_api": {
        "context_window_tokens": 1050000,
        "max_output_tokens": 128000,
        "source_uri": "https://developers.openai.com/api/docs/models/gpt-5.6-luna"
      }
    },
    "tools": {
      "profile_mode": "runtime_profile_ref",
      "profile_ref": "abyss-stack:external_codex_agent/structured-owner-duty-workspace-write-v1",
      "required_tools": [
        "shell-read",
        "workspace-write"
      ],
      "required_mcp_servers": [],
      "inheritance_allowed": false
    },
    "environment": {
      "role_profile_ref": "aoa-agents:task-local-selected-role-chain",
      "prompt_contract_ref": "aoa-models:structured-owner-duty-canary-v1",
      "cwd_policy": "dedicated-worktree",
      "instruction_policy": "owner-root-nearest-agents-and-bound-mandate",
      "locale": "ru"
    },
    "permissions": {
      "sandbox_mode": "workspace-write",
      "approval_policy": "never",
      "external_effects": false,
      "network_access": "disabled"
    },
    "economics": {
      "active_regime": "chatgpt_quota",
      "meter": "codex-subscription-usage",
      "reference_prices": [
        {
          "regime": "standard-api-short-context",
          "currency": "USD",
          "unit": "per_1m_tokens",
          "not_active_for_this_realization": true,
          "effective_at": "2026-08-08T08:12:22Z",
          "prices": {
            "input": 0.2,
            "cached_input": 0.02,
            "cache_write": 0.25,
            "output": 1.2
          },
          "source_uri": "https://developers.openai.com/api/docs/models/gpt-5.6-luna",
          "long_context_pricing": {
            "input_threshold_tokens": 272000,
            "input_multiplier": 2.0,
            "output_multiplier": 1.5,
            "scope": "full API request when input exceeds the threshold"
          }
        }
      ]
    }
  },
  "configuration_fingerprint": "sha256:8c0ddec7f9759747d5a3b92e68792c739bae8f4d551268089ac45a56c8bc4280",
  "observation_interval": {
    "start": "2026-08-24T06:23:38Z",
    "end": "2026-08-24T06:23:38Z"
  },
  "lifecycle_state": "declared",
  "source_refs": [
    {
      "source_id": "codex-0.149.1-package-metadata-2026-08-24",
      "kind": "live_runtime_output",
      "uri": "runtime:codex-cli-standalone/0.149.1/package-metadata",
      "observed_at": "2026-08-24T06:23:38Z",
      "content_digest": "sha256:756dcadcf9e968f0e62fa92fd020f4592e92d27dacec9887882600d39df69d5b",
      "notes": "Immutable owner evidence declares the standalone Codex package version 0.149.1, target x86_64-unknown-linux-musl, variant codex, and bin/codex entrypoint. This metadata envelope is not substituted for the content-addressed runtime subject digest."
    },
    {
      "source_id": "abyss-stack-0.149.1-runtime-subject-admission-2026-08-24",
      "kind": "live_runtime_output",
      "uri": "runtime:abyss-stack-external-codex-agent/active",
      "observed_at": "2026-08-24T06:23:38Z",
      "content_digest": "sha256:304089232ad96d67bf003f0fb59b2fccf305259ac5a1983e969aa6f1b85ca891",
      "notes": "The owner-admitted runtime artifact trust gate binds the exact aggregate subject digest used here, release sha256:746ce274ada4adcba69d6cb6b44e132c23f9162080198a41f52754f76dfa5941, and release-manifest sha256:aa68bb401b8af242ca14d8b8c762d34fd90050786337cf44f5c1b6a2e7360988. Runtime package members, admission and activation remain abyss-stack-owned; no member map from the 0.148.0 profile is transferred."
    },
    {
      "source_id": "aoa-models-currentness-procedure-2026-08-24",
      "kind": "repository_source",
      "uri": "task-local:procedure:aoa-models.codex-0.149.1-luna-currentness.20260824.v1",
      "observed_at": "2026-08-24T06:23:38Z",
      "content_digest": "sha256:fedc1ce47e2758dbc77c280fc7d72700b08eae53848cf24604bfe0978726f666",
      "notes": "Owner procedure limits this record to exact realization/currentness and configuration evidence; it does not authorize runtime activation, routing, proof, acceptance, or external effects."
    },
    {
      "source_id": "openai-gpt-5.6-luna-model-2026-08-11",
      "kind": "official_documentation",
      "uri": "https://developers.openai.com/api/docs/models/gpt-5.6-luna",
      "observed_at": "2026-08-11T02:09:22Z",
      "content_digest": null,
      "notes": "Provider capabilities and reference economics only; these fields do not establish 0.149.1 runtime currentness or task fit."
    }
  ],
  "created_at": "2026-08-24T06:23:38Z",
  "updated_at": "2026-08-24T06:23:38Z"
}
