{
  "$schema": "https://schemas.aoa.local/models/model-realization.schema.json",
  "schema_version": "aoa_model_realization_v1",
  "kind": "ModelRealization",
  "model_realization_id": "model-realization:openai/gpt-5.6-luna/codex-0.146.0/chatgpt/max/read-only/2026-08-01",
  "model_identity_ref": "source/model-identities/openai-gpt-5.6-luna.json",
  "configuration": {
    "access": {
      "provider": "OpenAI",
      "surface": "Codex CLI",
      "auth_regime": "chatgpt_login",
      "billing_regime": "chatgpt_quota",
      "supported_in_api": true
    },
    "runtime": {
      "product": "codex-cli",
      "version": "0.146.0",
      "executable": "codex",
      "model_slug": "gpt-5.6-luna",
      "transport": "exec-jsonl",
      "multi_agent_backend_version": "v1",
      "resume_surface": "codex exec resume"
    },
    "reasoning_effort": "max",
    "context": {
      "nominal_context_tokens": 272000,
      "effective_context_percent": 95,
      "regime": "codex-model-catalog-default"
    },
    "tools": {
      "profile_mode": "runtime_profile_ref",
      "profile_ref": "abyss-stack:external_codex_agent/luna-landing-readonly-v1",
      "required_tools": [
        "shell-read"
      ],
      "required_mcp_servers": [],
      "inheritance_allowed": false
    },
    "environment": {
      "role_profile_ref": "aoa-agents:reviewer/route-drift-review",
      "prompt_contract_ref": "aoa-models:luna-landing-fit-v1",
      "cwd_policy": "read-only-source",
      "instruction_policy": "owner-root-and-nearest-agents",
      "locale": "ru"
    },
    "permissions": {
      "sandbox_mode": "read-only",
      "approval_policy": "never",
      "external_effects": false,
      "network_access": "disabled"
    },
    "economics": {
      "active_regime": "chatgpt_quota",
      "meter": "codex-subscription-usage",
      "reference_prices": [
        {
          "regime": "standard-api-short-context",
          "currency": "USD",
          "unit": "per_1m_tokens",
          "not_active_for_this_realization": true,
          "effective_at": "2026-08-01T07:44:16Z",
          "prices": {
            "input": 0.2,
            "cached_input": 0.02,
            "cache_write": 0.25,
            "output": 1.2
          },
          "source_uri": "https://developers.openai.com/api/docs/pricing"
        }
      ]
    }
  },
  "configuration_fingerprint": "sha256:f4fc2366ed40471ec747638de5657810dd3a9f796c3d8b7081e0c8b705e30573",
  "observation_interval": {
    "start": "2026-08-01T07:44:16Z",
    "end": "2026-08-08T08:12:22Z"
  },
  "lifecycle_state": "stale",
  "source_refs": [
    {
      "source_id": "local-codex-model-catalog-luna-2026-08-01",
      "kind": "live_runtime_output",
      "uri": "command:codex-debug-models#gpt-5.6-luna",
      "observed_at": "2026-08-01T07:44:16Z",
      "content_digest": null,
      "notes": "Live catalog supports low, medium, high, xhigh, and max; default is medium."
    },
    {
      "source_id": "local-codex-login-status-2026-08-01",
      "kind": "live_runtime_output",
      "uri": "command:codex-login-status",
      "observed_at": "2026-08-01T07:44:16Z",
      "content_digest": null,
      "notes": "Logged in using ChatGPT; active economics are quota-based rather than direct API billing."
    },
    {
      "source_id": "openai-codex-noninteractive-2026-08-01",
      "kind": "official_documentation",
      "uri": "https://learn.chatgpt.com/docs/non-interactive-mode",
      "observed_at": "2026-08-01T07:44:16Z",
      "content_digest": null,
      "notes": "Documents JSONL events, output schema, explicit sandboxing, and session resume surfaces."
    },
    {
      "source_id": "openai-api-pricing-2026-08-01",
      "kind": "official_documentation",
      "uri": "https://developers.openai.com/api/docs/pricing",
      "observed_at": "2026-08-01T07:44:16Z",
      "content_digest": null,
      "notes": "API prices are retained as a comparison regime and are not asserted as the active ChatGPT quota cost."
    },
    {
      "source_id": "local-codex-version-transition-2026-08-08",
      "kind": "live_runtime_output",
      "uri": "command:codex-version",
      "observed_at": "2026-08-08T08:12:22Z",
      "content_digest": null,
      "notes": "The installed Codex runtime is 0.147.0; this exact 0.146.0 realization is preserved as historical evidence and is not current activation input."
    }
  ],
  "created_at": "2026-08-01T07:44:16Z",
  "updated_at": "2026-08-08T08:12:22Z",
  "lifecycle_transition": {
    "from": "declared",
    "to": "stale",
    "at": "2026-08-08T08:12:22Z",
    "reason": "The exact Codex CLI version changed from 0.146.0 to 0.147.0.",
    "evidence_refs": [
      "local-codex-version-transition-2026-08-08"
    ]
  }
}
