{
  "$schema": "https://schemas.aoa.local/models/model-realization.schema.json",
  "schema_version": "aoa_model_realization_v1",
  "kind": "ModelRealization",
  "model_realization_id": "model-realization:openai/gpt-5.6-luna/codex-0.149.1/chatgpt/max/structured-independent-review/read-only/2026-08-25",
  "model_identity_ref": "source/model-identities/openai-gpt-5.6-luna.json",
  "configuration": {
    "access": {
      "provider": "OpenAI",
      "surface": "Codex CLI",
      "auth_regime": "chatgpt_login",
      "billing_regime": "chatgpt_quota",
      "supported_in_api": true
    },
    "runtime": {
      "product": "codex-cli",
      "version": "0.149.1",
      "executable": "codex",
      "model_slug": "gpt-5.6-luna",
      "transport": "exec-jsonl",
      "multi_agent_backend_version": "v1",
      "runtime_subject": {
        "kind": "content_addressed_runtime_package",
        "source": "codex-cli-standalone/x86_64-unknown-linux-musl+codex-code-mode-host",
        "digest": "sha256:304089232ad96d67bf003f0fb59b2fccf305259ac5a1983e969aa6f1b85ca891"
      },
      "resume_surface": "codex exec resume"
    },
    "reasoning_effort": "max",
    "context": {
      "nominal_context_tokens": 272000,
      "effective_context_percent": 95,
      "regime": "codex-model-catalog-default",
      "native_api": {
        "context_window_tokens": 1050000,
        "max_output_tokens": 128000,
        "source_uri": "https://developers.openai.com/api/docs/models/gpt-5.6-luna"
      }
    },
    "tools": {
      "profile_mode": "runtime_profile_ref",
      "profile_ref": "abyss-stack:external_codex_agent/landing-readonly-v2",
      "required_tools": [
        "shell-read"
      ],
      "required_mcp_servers": [],
      "inheritance_allowed": false
    },
    "environment": {
      "role_profile_ref": "aoa-agents:reviewer/route-drift-review",
      "prompt_contract_ref": "aoa-models:luna-landing-fit-v2",
      "cwd_policy": "read-only-source",
      "instruction_policy": "owner-root-nearest-agents-and-bound-mandate",
      "locale": "ru"
    },
    "permissions": {
      "sandbox_mode": "read-only",
      "approval_policy": "never",
      "external_effects": false,
      "network_access": "disabled"
    },
    "economics": {
      "active_regime": "chatgpt_quota",
      "meter": "codex-subscription-usage",
      "reference_prices": [
        {
          "regime": "standard-api-short-context",
          "currency": "USD",
          "unit": "per_1m_tokens",
          "not_active_for_this_realization": true,
          "effective_at": "2026-08-08T08:12:22Z",
          "prices": {
            "input": 0.2,
            "cached_input": 0.02,
            "cache_write": 0.25,
            "output": 1.2
          },
          "source_uri": "https://developers.openai.com/api/docs/models/gpt-5.6-luna",
          "long_context_pricing": {
            "input_threshold_tokens": 272000,
            "input_multiplier": 2.0,
            "output_multiplier": 1.5,
            "scope": "full API request when input exceeds the threshold"
          }
        }
      ]
    }
  },
  "configuration_fingerprint": "sha256:f742b4306f5ad08c7e9859a6189be5c0dda1e8d680ab27048e9ba7dbbc361b39",
  "observation_interval": {
    "start": "2026-08-25T19:36:31Z",
    "end": null
  },
  "lifecycle_state": "declared",
  "source_refs": [
    {
      "source_id": "codex-0.149.1-current-package-metadata",
      "kind": "live_runtime_output",
      "uri": "runtime:codex-cli-standalone/0.149.1/package-metadata",
      "observed_at": "2026-08-25T19:36:31Z",
      "content_digest": "sha256:756dcadcf9e968f0e62fa92fd020f4592e92d27dacec9887882600d39df69d5b",
      "notes": "Current owner evidence identifies the standalone Codex package version 0.149.1, target x86_64-unknown-linux-musl, variant codex, and bin/codex entrypoint. Package metadata is kept separate from the exact runtime subject and task fit."
    },
    {
      "source_id": "codex-0.149.1-current-runtime-subject",
      "kind": "live_runtime_output",
      "uri": "file:/srv/abyss-machine/runtimes/abyss-stack/external-codex-agent/releases/sha256-0946e21178a033482b321e90e04efcaeb7e10b2dbac2af7d76ab196be58559c1/runtime/runtime-profile.v1.json",
      "observed_at": "2026-08-25T19:36:31Z",
      "content_digest": "sha256:304089232ad96d67bf003f0fb59b2fccf305259ac5a1983e969aa6f1b85ca891",
      "notes": "The active abyss-stack release profile names Codex CLI 0.149.1 and this exact runtime subject. It also exposes the read-only shell-read landing profile with disabled network and no external effects; activation and process truth remain abyss-stack-owned."
    },
    {
      "source_id": "abyss-stack-0.149.1-current-artifact-admission",
      "kind": "live_runtime_output",
      "uri": "file:/srv/abyss-machine/runtimes/abyss-stack/external-codex-agent/active.json",
      "observed_at": "2026-08-25T19:36:31Z",
      "content_digest": "sha256:6d26795aed8d137a09cc74ff36c8963a918f1b4fdf95b47703ebb5e0090fccb1",
      "notes": "The active runtime selects release sha256:0946e21178a033482b321e90e04efcaeb7e10b2dbac2af7d76ab196be58559c1 and records an allow decision through the artifact trust gate. This is admission evidence, not activation or behavioral proof."
    },
    {
      "source_id": "aoa-models-runtime-subject-currentness-law",
      "kind": "repository_source",
      "uri": "repo:aoa-models@HEAD#docs/decisions/AOA-MODELS-D-0004-runtime-subject-currentness.md",
      "observed_at": "2026-08-25T20:03:48Z",
      "content_digest": "sha256:7a58059f4e58328d14e161ae192935409ba54b5e33f1db8424e389cd24562542",
      "notes": "Owner law requires exact runtime-subject currentness to remain distinct from version, realization configuration, activation, proof, routing, and acceptance."
    }
  ],
  "created_at": "2026-08-25T20:03:48Z",
  "updated_at": "2026-08-25T20:03:48Z"
}
